{"$defs":{"quality_gate_report.v1":{"$id":"https://orbital-dynamics.local/schemas/quality_gate_report.v1.schema.json","$schema":"https://json-schema.org/draft/2020-12/schema","additionalProperties":true,"properties":{"quality_gate_row_ids_by_classification":{"additionalProperties":{"items":{"pattern":"^[A-Za-z0-9][A-Za-z0-9._:@-]*$","type":"string"},"type":"array"},"type":"object"},"execution_boundary":{"enum":["adapter_handoff_only","operator_review_required_before_import","analysis_only_not_for_execution","blocked_not_for_import_or_execution"],"type":"string"},"operator_authority_granted":{"type":"boolean"},"schema_version":{"const":1,"description":"Artifact schema version","type":"integer"},"import_classification":{"enum":["importable","review_only","analysis_only","blocked"],"type":"string"},"source_artifact_id":{"pattern":"^[A-Za-z0-9][A-Za-z0-9._:@-]*$","type":"string"},"readiness_level":{"enum":["import_eligible","operator_review","analysis_only","blocked"],"type":"string"},"analysis_gate_count":{"minimum":0,"type":"integer"},"execution_allowed":{"type":"boolean"},"review_gate_count":{"minimum":0,"type":"integer"},"gate_count":{"minimum":0,"type":"integer"},"analysis_only_gate_ids":{"items":{"pattern":"^[A-Za-z0-9][A-Za-z0-9._:@-]*$","type":"string"},"type":"array"},"gate_classification_counts":{"additionalProperties":{"minimum":0,"type":"integer"},"type":"object"},"schema_contract":{"const":"quality_gate_report.v1","description":"Stable executable contract identifier","type":"string"},"model":{"const":"artifact_only_operational_quality_gate_report","type":"string"},"passed_gate_count":{"minimum":0,"type":"integer"},"source_readiness_report_id":{"pattern":"^[A-Za-z0-9][A-Za-z0-9._:@-]*$","type":"string"},"source_artifact_type":{"type":"string"},"status":{"enum":["passed","review_required","analysis_only","blocked"],"type":"string"},"report_id":{"pattern":"^[A-Za-z0-9][A-Za-z0-9._:@-]*$","type":"string"},"gate_ids_by_status":{"additionalProperties":{"items":{"pattern":"^[A-Za-z0-9][A-Za-z0-9._:@-]*$","type":"string"},"type":"array"},"type":"object"},"gate_status_counts":{"additionalProperties":{"minimum":0,"type":"integer"},"type":"object"},"cadence_write_allowed":{"type":"boolean"},"model_limits":{"const":["quality_gate_report_derives_classification_from_gate_rows","quality_gate_report_does_not_approve_or_import"],"items":{"enum":["quality_gate_report_derives_classification_from_gate_rows","quality_gate_report_does_not_approve_or_import"],"type":"string"},"type":"array"},"review_required_gate_ids":{"items":{"pattern":"^[A-Za-z0-9][A-Za-z0-9._:@-]*$","type":"string"},"type":"array"},"blocked_gate_count":{"minimum":0,"type":"integer"},"handoff_only":{"type":"boolean"},"rows":{"items":{"additionalProperties":true,"properties":{"adapter_boundary_status_counts":{"additionalProperties":{"minimum":0,"type":"integer"},"propertyNames":{"enum":["declared","missing","untrusted"]},"type":"object"},"adapter_context_count":{"minimum":0,"type":"integer"},"adapter_trust_boundary_declared_count":{"minimum":0,"type":"integer"},"adapter_trust_boundary_missing_count":{"minimum":0,"type":"integer"},"adapter_trust_boundary_untrusted_count":{"minimum":0,"type":"integer"},"analysis_mode":{"enum":["analysis_only","simulation","rehearsal","trade_study","training","not_for_execution"],"type":"string"},"analysis_mode_source":{"type":"string"},"classification":{"enum":["importable","review_only","analysis_only","blocked"],"type":"string"},"gate_id":{"enum":["source_contract","operational_mode","adapter_boundary","mission_policy","operator_training","resource_availability","operator_review","cadence_import"],"type":"string"},"id":{"pattern":"^[A-Za-z0-9][A-Za-z0-9._:@-]*$","type":"string"},"operator_training_requirement_count":{"minimum":0,"type":"integer"},"operator_training_requirement_counts":{"additionalProperties":{"minimum":0,"type":"integer"},"type":"object"},"rank":{"minimum":1,"type":"integer"},"reason":{"type":"string"},"required_certification_ids":{"items":{"type":"string"},"type":"array"},"required_operator_roles":{"items":{"type":"string"},"type":"array"},"required_qualification_ids":{"items":{"type":"string"},"type":"array"},"required_training_ids":{"items":{"type":"string"},"type":"array"},"resource_availability_pressure_count":{"minimum":0,"type":"integer"},"resource_availability_reason_counts":{"additionalProperties":{"minimum":0,"type":"integer"},"type":"object"},"resource_availability_reason_ids":{"items":{"type":"string"},"type":"array"},"resource_blocked_contact_ids_by_blocking_dimension":{"additionalProperties":{"items":{"pattern":"^[A-Za-z0-9][A-Za-z0-9._:@-]*$","type":"string"},"type":"array"},"type":"object"},"resource_blocked_contact_ids_by_spacecraft_id":{"additionalProperties":{"items":{"pattern":"^[A-Za-z0-9][A-Za-z0-9._:@-]*$","type":"string"},"type":"array"},"type":"object"},"resource_blocking_dimension_counts":{"additionalProperties":{"minimum":0,"type":"integer"},"type":"object"},"resource_source_quality_counts":{"additionalProperties":{"minimum":0,"type":"integer"},"type":"object"},"resource_trust_boundary_status_counts":{"additionalProperties":{"minimum":0,"type":"integer"},"type":"object"},"source_operational_readiness_gate":{"additionalProperties":true,"properties":{"schema_validation_status_counts":{"additionalProperties":{"minimum":0,"type":"integer"},"type":"object"},"station_availability_reason_counts":{"additionalProperties":{"minimum":0,"type":"integer"},"type":"object"},"missing_import_count":{"minimum":0,"type":"integer"},"resource_trust_boundary_status_counts":{"additionalProperties":{"minimum":0,"type":"integer"},"type":"object"},"resource_blocked_contact_ids_by_blocking_dimension":{"additionalProperties":{"items":{"pattern":"^[A-Za-z0-9][A-Za-z0-9._:@-]*$","type":"string"},"type":"array"},"type":"object"},"manifest_review_required_count":{"minimum":0,"type":"integer"},"resource_availability_pressure_count":{"minimum":0,"type":"integer"},"resource_source_quality_counts":{"additionalProperties":{"minimum":0,"type":"integer"},"type":"object"},"analysis_mode_source":{"type":"string"},"ready_for_import_count":{"minimum":0,"type":"integer"},"reason":{"type":"string"},"operator_training_requirement_counts":{"additionalProperties":{"minimum":0,"type":"integer"},"type":"object"},"resource_availability_reason_ids":{"items":{"type":"string"},"type":"array"},"schema_validation_pass_count":{"minimum":0,"type":"integer"},"freshness_status_counts":{"additionalProperties":{"minimum":0,"type":"integer"},"type":"object"},"station_availability_reason_ids":{"items":{"type":"string"},"type":"array"},"invalid_cadence_import_count":{"minimum":0,"type":"integer"},"schema_validation_error_count":{"minimum":0,"type":"integer"},"required_training_ids":{"items":{"type":"string"},"type":"array"},"schema_validation_fail_count":{"minimum":0,"type":"integer"},"required_qualification_ids":{"items":{"type":"string"},"type":"array"},"id":{"enum":["source_contract","operational_mode","adapter_boundary","mission_policy","operator_training","resource_availability","operator_review","cadence_import"],"type":"string"},"operator_training_requirement_count":{"minimum":0,"type":"integer"},"schema_validation_warning_count":{"minimum":0,"type":"integer"},"status":{"enum":["passed","review_required","analysis_only","blocked"],"type":"string"},"schema_validation_remediation_count":{"minimum":0,"type":"integer"},"current_freshness_count":{"minimum":0,"type":"integer"},"resource_availability_reason_counts":{"additionalProperties":{"minimum":0,"type":"integer"},"type":"object"},"blocked_import_count":{"minimum":0,"type":"integer"},"required_operator_roles":{"items":{"type":"string"},"type":"array"},"classification":{"enum":["importable","review_only","analysis_only","blocked"],"type":"string"},"required_certification_ids":{"items":{"type":"string"},"type":"array"},"resource_blocked_contact_ids_by_spacecraft_id":{"additionalProperties":{"items":{"pattern":"^[A-Za-z0-9][A-Za-z0-9._:@-]*$","type":"string"},"type":"array"},"type":"object"},"resource_blocking_dimension_counts":{"additionalProperties":{"minimum":0,"type":"integer"},"type":"object"},"analysis_mode":{"enum":["analysis_only","simulation","rehearsal","trade_study","training","not_for_execution"],"type":"string"},"stale_freshness_count":{"minimum":0,"type":"integer"},"cadence_import_status_counts":{"additionalProperties":{"minimum":0,"type":"integer"},"type":"object"},"unknown_freshness_count":{"minimum":0,"type":"integer"},"import_status_counts":{"additionalProperties":{"minimum":0,"type":"integer"},"type":"object"},"unavailable_resource_reason_ids":{"items":{"type":"string"},"type":"array"}},"required":["id","status","classification","reason"],"type":"object"},"station_availability_reason_counts":{"additionalProperties":{"minimum":0,"type":"integer"},"type":"object"},"station_availability_reason_ids":{"items":{"type":"string"},"type":"array"},"status":{"enum":["passed","review_required","analysis_only","blocked"],"type":"string"},"unavailable_resource_reason_ids":{"items":{"type":"string"},"type":"array"}},"required":["id","rank","gate_id","status","classification","reason"],"type":"object"},"type":"array"},"quality_gate_row_ids_by_status":{"additionalProperties":{"items":{"pattern":"^[A-Za-z0-9][A-Za-z0-9._:@-]*$","type":"string"},"type":"array"},"type":"object"},"blocked_gate_ids":{"items":{"pattern":"^[A-Za-z0-9][A-Za-z0-9._:@-]*$","type":"string"},"type":"array"},"assumptions":{"additionalProperties":true,"type":"object"},"passed_gate_ids":{"items":{"pattern":"^[A-Za-z0-9][A-Za-z0-9._:@-]*$","type":"string"},"type":"array"},"gate_ids_by_classification":{"additionalProperties":{"items":{"pattern":"^[A-Za-z0-9][A-Za-z0-9._:@-]*$","type":"string"},"type":"array"},"type":"object"}},"required":["schema_contract","schema_version","model","report_id","source_artifact_type","source_artifact_id","source_readiness_report_id","readiness_level","import_classification","status","handoff_only","execution_allowed","cadence_write_allowed","operator_authority_granted","execution_boundary","gate_count","passed_gate_count","review_gate_count","analysis_gate_count","blocked_gate_count","gate_status_counts","gate_classification_counts","rows","assumptions","model_limits"],"title":"OrbitalDynamics quality_gate_report.v1","type":"object","x-orbital-dynamics":{"artifact_family":"quality_gate_report","compatibility_policy_version":1,"executable_contract":true,"identity_policy_version":1,"nested_contract_definition_scope":"direct_declared_contracts","nested_contracts":["operational_readiness_report.v1"],"schema_contract":"quality_gate_report.v1","schema_version":1,"validation_mode":"top_level_compatibility_export"}}},"$id":"https://orbital-dynamics.local/schemas/operational_quality_gate_import_readiness_summary.v1.schema.json","$schema":"https://json-schema.org/draft/2020-12/schema","additionalProperties":true,"properties":{"missing_import_count":{"minimum":0,"type":"integer"},"analysis_only_quality_gate_row_ids":{"items":{"pattern":"^[A-Za-z0-9][A-Za-z0-9._:@-]*$","type":"string"},"type":"array"},"manifest_review_required_count":{"minimum":0,"type":"integer"},"import_preparation_quality_gate_row_ids":{"items":{"type":"string"},"type":"array"},"ready_for_import_count":{"minimum":0,"type":"integer"},"review_required_quality_gate_row_ids":{"items":{"type":"string"},"type":"array"},"ready_quality_gate_row_ids":{"items":{"type":"string"},"type":"array"},"source_quality_gate_report_id":{"pattern":"^[A-Za-z0-9][A-Za-z0-9._:@-]*$","type":"string"},"source_artifact_id":{"pattern":"^[A-Za-z0-9][A-Za-z0-9._:@-]*$","type":"string"},"freshness_status_counts":{"additionalProperties":{"minimum":0,"type":"integer"},"type":"object"},"import_preparation_required":{"type":"boolean"},"freshness_review_required":{"type":"boolean"},"invalid_cadence_import_count":{"minimum":0,"type":"integer"},"schema_contract":{"const":"operational_quality_gate_import_readiness_summary.v1","type":"string"},"model":{"const":"artifact_only_quality_gate_import_readiness_summary","type":"string"},"cadence_import_status_ids":{"items":{"type":"string"},"type":"array"},"import_blocked":{"type":"boolean"},"source_readiness_report_id":{"pattern":"^[A-Za-z0-9][A-Za-z0-9._:@-]*$","type":"string"},"source_artifact_type":{"type":"string"},"current_freshness_count":{"minimum":0,"type":"integer"},"blocked_import_count":{"minimum":0,"type":"integer"},"blocked_import_quality_gate_row_ids":{"items":{"type":"string"},"type":"array"},"import_readiness_gate_ids":{"items":{"type":"string"},"type":"array"},"source":{"enum":["quality_gate_report.v1"],"type":"string"},"import_readiness_row_count":{"minimum":0,"type":"integer"},"model_limits":{"const":["quality_gate_import_readiness_summary_routes_only","quality_gate_import_readiness_summary_does_not_approve_or_import"],"items":{"enum":["quality_gate_import_readiness_summary_routes_only","quality_gate_import_readiness_summary_does_not_approve_or_import"],"type":"string"},"type":"array"},"blocked_quality_gate_row_ids":{"items":{"type":"string"},"type":"array"},"stale_or_unknown_freshness_quality_gate_row_ids":{"items":{"type":"string"},"type":"array"},"import_status_ids":{"items":{"type":"string"},"type":"array"},"freshness_status_ids":{"items":{"type":"string"},"type":"array"},"quality_gate_row_ids_by_status":{"additionalProperties":{"items":{"pattern":"^[A-Za-z0-9][A-Za-z0-9._:@-]*$","type":"string"},"type":"array"},"type":"object"},"assumptions":{"additionalProperties":true,"type":"object"},"quality_gate_ids_by_status":{"additionalProperties":{"items":{"pattern":"^[A-Za-z0-9][A-Za-z0-9._:@-]*$","type":"string"},"type":"array"},"type":"object"},"stale_freshness_count":{"minimum":0,"type":"integer"},"cadence_import_status_counts":{"additionalProperties":{"minimum":0,"type":"integer"},"type":"object"},"unknown_freshness_count":{"minimum":0,"type":"integer"},"import_status_counts":{"additionalProperties":{"minimum":0,"type":"integer"},"type":"object"}},"required":["schema_contract","model","source","source_artifact_type","source_artifact_id","source_quality_gate_report_id","source_readiness_report_id","import_readiness_row_count","ready_for_import_count","manifest_review_required_count","blocked_import_count","missing_import_count","invalid_cadence_import_count","current_freshness_count","stale_freshness_count","unknown_freshness_count","freshness_status_counts","freshness_status_ids","import_status_counts","import_status_ids","cadence_import_status_counts","cadence_import_status_ids","freshness_review_required","import_preparation_required","import_blocked","quality_gate_row_ids_by_status","quality_gate_ids_by_status","review_required_quality_gate_row_ids","blocked_quality_gate_row_ids","ready_quality_gate_row_ids","stale_or_unknown_freshness_quality_gate_row_ids","import_preparation_quality_gate_row_ids","blocked_import_quality_gate_row_ids","import_readiness_gate_ids","assumptions","model_limits"],"title":"OrbitalDynamics operational_quality_gate_import_readiness_summary.v1","type":"object","x-orbital-dynamics":{"artifact_family":"operational_quality_gate_import_readiness_summary","compatibility_policy":{"breaking_change_action":"mint a new schema_contract name or increment the artifact schema_version before publishing","breaking_changes":["remove_required_fields","change_required_field_type","change_schema_contract_identifier","change_schema_version_const","change_required_field_semantics"],"compatible_changes":["add_optional_fields","add_optional_nested_contracts","tighten_executable_semantic_validation_without_changing_exported_required_fields"],"policy_version":1,"validation_mode":"top_level_compatibility_export"},"compatibility_policy_version":1,"executable_contract":true,"identity_policy":{"breaking_changes":["change_existing_public_identifier_for_the_same_semantic_entity","emit_blank_identifier","emit_identifier_with_whitespace"],"compatible_changes":["add_optional_identifier_fields","add_more_specific_semantic_source_metadata_without_changing_existing_ids"],"description":"Public artifact identifiers are non-empty machine identifiers without whitespace.","generated_id_scopes":[{"identity_fields":["scenario_id","type","source_window_id","target_id","ground_station_id"],"ordering":["result_event_type","scenario_id","source_window_id","starts_at_s"],"scope":"candidate_refresh.v1.candidate_activities"},{"identity_fields":["spacecraft_id","scenario_id","epoch.seconds_since_j2000"],"ordering":["spacecraft_id","scenario_id","epoch.seconds_since_j2000"],"scope":"accepted_planning_state.v1.spacecraft_states"},{"generated_id_field":"id","identity_fields":["resource_scope","ground_station_id","spacecraft_id","starts_at_s","ends_at_s","contact_ids"],"ordering":["resource_scope","ground_station_id","spacecraft_id","starts_at_s","id"],"scope":"contact_contention_report.v1.conflict_groups.generated_group_id","semantic_invariants":["source_record_order_must_not_change_generated_group_id","canonical_contact_sort_key_must_drive_conflict_group_index","same_semantic_contention_group_must_keep_generated_group_id"]},{"generated_id_field":"group_id","identity_fields":["group_id","resource_scope","ground_station_id","spacecraft_id","starts_at_s","selected_contact_id","deferred_contact_ids"],"ordering":["resource_scope","ground_station_id","spacecraft_id","starts_at_s","group_id"],"scope":"contact_contention_resolution_report.v1.recommendations.generated_group_id","semantic_invariants":["contention_group_id_must_flow_to_recommendation_group_id","source_record_order_must_not_change_recommendation_group_id","resolution_ordering_must_not_change_group_identity"]},{"explicit_id_fields":["route_id","id","data_path_id"],"identity_fields":["source_spacecraft_id","relay_chain_spacecraft_ids","ground_station_id","ground_downlink_contact_id","latency_s","latency_limit_s","product_ids","collection_ids"],"ordering":["source_spacecraft_id","ground_downlink_contact_id","semantic_route_fingerprint"],"scope":"relay_data_path_summary.v1.rows.generated_route_id","semantic_invariants":["source_record_order_must_not_change_generated_route_id","semantic_route_evidence_changes_must_change_generated_route_id","explicit_route_id_takes_precedence_over_generated_route_id"]}],"policy_version":1,"semantic_invariants":["source_record_order_must_not_change_generated_identity","semantic_source_identity_must_remain_stable_across_manifest_export","scenario_and_activity_identity_must_not_depend_on_wall_clock_time"],"stable_id_pattern":"^[A-Za-z0-9][A-Za-z0-9._:@-]*$"},"identity_policy_version":1,"nested_contract_definition_scope":"direct_declared_contracts","nested_contracts":["quality_gate_report.v1"],"schema_contract":"operational_quality_gate_import_readiness_summary.v1","schema_version":1,"validation_mode":"top_level_compatibility_export"}}
