{"missing_import_count":0,"analysis_only_quality_gate_row_ids":[],"manifest_review_required_count":0,"import_preparation_quality_gate_row_ids":[],"ready_for_import_count":1,"review_required_quality_gate_row_ids":["quality_gate:planned_activity.v1:activity_1:cadence_import:5"],"ready_quality_gate_row_ids":[],"source_quality_gate_report_id":"quality_gate:planned_activity.v1:activity_1","source_artifact_id":"activity_1","freshness_status_counts":{"stale":1},"import_preparation_required":false,"freshness_review_required":true,"invalid_cadence_import_count":0,"schema_contract":"operational_quality_gate_import_readiness_summary.v1","model":"artifact_only_quality_gate_import_readiness_summary","cadence_import_status_ids":["present"],"import_blocked":false,"source_readiness_report_id":"operational_readiness:planned_activity.v1:activity_1","source_artifact_type":"planned_activity.v1","current_freshness_count":0,"blocked_import_count":0,"blocked_import_quality_gate_row_ids":[],"import_readiness_gate_ids":["cadence_import"],"source":"quality_gate_report.v1","import_readiness_row_count":1,"model_limits":["quality_gate_import_readiness_summary_routes_only","quality_gate_import_readiness_summary_does_not_approve_or_import"],"blocked_quality_gate_row_ids":[],"stale_or_unknown_freshness_quality_gate_row_ids":["quality_gate:planned_activity.v1:activity_1:cadence_import:5"],"import_status_ids":["ready_for_import"],"freshness_status_ids":["stale"],"quality_gate_row_ids_by_status":{"review_required":["quality_gate:planned_activity.v1:activity_1:cadence_import:5"]},"assumptions":{"cadence_write":"not_performed_by_summary","command_execution":"not_performed_by_summary","execution_boundary":"artifact_only_no_cadence_write","operator_authority":"not_granted_by_import_readiness_summary","source":"quality_gate_report.v1"},"quality_gate_ids_by_status":{"review_required":["cadence_import"]},"stale_freshness_count":1,"cadence_import_status_counts":{"present":1},"unknown_freshness_count":0,"import_status_counts":{"ready_for_import":1}}